{
  "$schema": "https://json-schema.org/draft/2020-12/schema",
  "$id": "https://hunterr.dev/fuse/schemas/umm-info.schema.json",
  "title": "FUSE Unity Mod Manager Info.json",
  "description": "UMM manifest shape for the FUSE API mod and FUSE data packages.",
  "type": "object",
  "additionalProperties": true,
  "required": [
    "Id",
    "DisplayName",
    "Author",
    "Version",
    "ManagerVersion"
  ],
  "properties": {
    "$schema": {
      "type": "string"
    },
    "Id": {
      "$ref": "#/$defs/id"
    },
    "DisplayName": {
      "type": "string",
      "minLength": 1
    },
    "Author": {
      "type": "string",
      "minLength": 1
    },
    "Version": {
      "type": "string",
      "minLength": 1
    },
    "ManagerVersion": {
      "type": "string",
      "minLength": 1
    },
    "GameVersion": {
      "type": "string"
    },
    "AssemblyName": {
      "type": "string",
      "description": "Required for code mods like FUSE. Omit for FUSE data-only packages if UMM accepts the folder."
    },
    "EntryMethod": {
      "type": "string",
      "description": "Required when AssemblyName is present."
    },
    "HomePage": {
      "type": "string"
    },
    "Repository": {
      "type": "string"
    },
    "Requirements": {
      "type": "array",
      "items": {
        "$ref": "#/$defs/dependency"
      },
      "default": []
    },
    "LoadAfter": {
      "type": "array",
      "items": {
        "$ref": "#/$defs/dependency"
      },
      "default": []
    },
    "FuseLoadPriority": {
      "type": "integer",
      "default": 0,
      "description": "FUSE-specific package ordering priority. Lower values load earlier; ties fall back to dependency order, then package id."
    },
    "FuseLoadAfter": {
      "type": "array",
      "items": {
        "$ref": "#/$defs/dependency"
      },
      "default": [],
      "description": "FUSE-specific data package ids that must load before this package."
    },
    "FuseLoadBefore": {
      "type": "array",
      "items": {
        "$ref": "#/$defs/dependency"
      },
      "default": [],
      "description": "FUSE-specific data package ids that must load after this package."
    },
    "FuseDataFile": {
      "type": "string",
      "pattern": "^.+\\.(bson|json)$",
      "description": "FUSE-specific pointer to one mod definition file in this UMM folder."
    },
    "FuseDataFiles": {
      "type": "array",
      "items": {
        "type": "string",
        "pattern": "^.+\\.(bson|json)$"
      },
      "default": [],
      "description": "FUSE-specific ordered list of definition fragments to load from this UMM folder."
    },
    "FuseAssetPacks": {
      "oneOf": [
        {
          "type": "string",
          "minLength": 1
        },
        {
          "type": "array",
          "items": {
            "type": "string",
            "minLength": 1
          },
          "default": []
        }
      ],
      "description": "FUSE-specific relative folder or folders containing Railroader AssetPack Runtime stores, for example SCAssetPacks."
    },
    "Settings": {
      "type": "object",
      "additionalProperties": true,
      "properties": {
        "EnableExperimentalEarlyScenePathSuppression": {
          "type": "boolean",
          "default": false,
          "description": "Experimental. Gates Unity async scene activation so world.suppressBaseScenePaths can be applied as early as Unity exposes scene objects. Disabled by default because a failed gate can wedge scene loading."
        },
        "MirrorAssetPacksToLocalLow": {
          "type": "boolean",
          "default": false,
          "description": "Copies asset-pack folders to LocalLow before loading. Disabled by default; use only as a fallback for known-compatible asset packs."
        },
        "VerboseApplyReportDetails": {
          "type": "boolean",
          "default": false,
          "description": "Writes per-object apply details to FUSE.log for package debugging. Disabled by default to keep public beta logs readable."
        },
        "BlockNonHostMultiplayerClientWorldApply": {
          "type": "boolean",
          "default": false,
          "description": "Strict multiplayer safety switch. When true, non-host clients skip runtime graph/world/operations/progression mutation instead of using legacy-style compatibility mode."
        },
        "ShowAdvancedHealthDetails": {
          "type": "boolean",
          "default": false,
          "description": "Shows advanced diagnostics across the FUSE menu pages such as asset duplicate winners, full asset store paths, registry internals, and advanced mod settings. Disabled by default to keep the public UI curated."
        }
      }
    }
  },
  "dependentRequired": {
    "AssemblyName": [
      "EntryMethod"
    ],
    "EntryMethod": [
      "AssemblyName"
    ]
  },
  "$defs": {
    "id": {
      "type": "string",
      "minLength": 1,
      "pattern": "^[A-Za-z0-9][A-Za-z0-9._:-]*$"
    },
    "dependency": {
      "oneOf": [
        {
          "$ref": "#/$defs/id"
        },
        {
          "type": "object",
          "additionalProperties": true,
          "required": [
            "Id"
          ],
          "properties": {
            "Id": {
              "$ref": "#/$defs/id"
            },
            "NotBefore": {
              "type": "string"
            }
          }
        }
      ]
    }
  }
}
