{
  "Id": "FUSE",
  "DisplayName": "FUSE",
  "Author": "Hunter Rogers",
  "Version": "0.0.0",
  "ManagerVersion": "0.27.10",
  "GameVersion": "2025.1",
  "AssemblyName": "FUSE.dll",
  "EntryMethod": "FUSE.FusePlugin.Load",
  "HomePage": "",
  "Settings": {
    "EnableExperimentalEarlyScenePathSuppression": false,
    "MirrorAssetPacksToLocalLow": false,
    "VerboseApplyReportDetails": false,
    "BlockNonHostMultiplayerClientWorldApply": false,
    "ShowAdvancedHealthDetails": false
  }
}
