{
  "$schema": "./umm-info.schema.json",
  "Id": "FUSE.Example.MurphyBranch",
  "DisplayName": "Murphy Branch",
  "Author": "",
  "Version": "1.0.0",
  "ManagerVersion": "0.27.10",
  "GameVersion": "2025.1",
  "Requirements": [
    {
      "Id": "FUSE",
      "NotBefore": "1.0.0"
    }
  ],
  "LoadAfter": [
    "FUSE"
  ],
  "FuseLoadPriority": 100,
  "FuseLoadAfter": [],
  "FuseLoadBefore": [],
  "FuseDataFiles": [
    "track.fuse.json",
    "operations.fuse.json",
    "world.fuse.json",
    "progression.fuse.json"
  ],
  "FuseAssetPacks": [
    "SCAssetPacks"
  ]
}
