{
    "Id":  "Toolshed",
    "DisplayName":  "Toolshed",
    "Author":  "Hunter Rogers",
    "Version":  "0.3.0",
    "ManagerVersion":  "0.27.10",
    "AssemblyName":  "Toolshed.dll",
    "EntryMethod":  "Toolshed.Main.Load",
    "Requirements":  [
                         "FUSE"
                     ],
    "LoadAfter":  [
                      "FUSE"
                  ],
    "FuseAssetPacks":  [
                           "SCAssetPacks"
                       ]
}
